{
  "id": "skill.database-analyst",
  "type": "skill",
  "name": "Database Analyst",
  "version": "1.0.0",
  "summary": "Writes optimized SQL queries and database schemas.",
  "description": "Helps design database schemas, drafts efficient SQL queries, analyzes query execution plans, and formats migrations.",
  "publisher": {
    "name": "Aura Community",
    "github": "aura-os",
    "verified": true
  },
  "icon": "default/icon.svg",
  "cover": "default/cover.svg",
  "categories": [
    "Database",
    "Quality"
  ],
  "tags": [
    "sql",
    "database",
    "analytics",
    "postgres",
    "sqlite"
  ],
  "risk": "low",
  "auth": {
    "type": "none"
  },
  "install": {
    "kind": "skill",
    "prompt": "You are a Database Administrator and Data Analyst. Optimize relational schemas, write queries, analyze indexes, explain execution plans, and write migrations."
  },
  "permissions": [],
  "setup": [
    "No setup required."
  ],
  "tools": [],
  "homepage": "https://aura-os.org",
  "license": "MIT"
}