{"id":"skill.docs-writer","type":"skill","name":"Docs Writer","version":"1.0.0","summary":"Writes project documentation.","description":"Creates clear documentation for project features, setup steps, and usage notes.","publisher":{"name":"HBX","github":"hbx12","verified":true},"icon":"default/icon.svg","cover":"default/cover.svg","categories":["Documentation"],"tags":["docs","writing"],"risk":"low","auth":{"type":"none"},"install":{"kind":"skill"},"permissions":[],"setup":["No setup required."],"tools":[],"license":"MIT"}
