{
  "id": "skill.code-reviewer",
  "type": "skill",
  "name": "Code Reviewer",
  "version": "1.0.0",
  "summary": "Provides detailed feedback on pull requests and commits.",
  "description": "Acts as a senior reviewer analyzing style, structure, complexity, test coverage, and performance. Emits standard code review checklists.",
  "publisher": {
    "name": "Aura Community",
    "github": "aura-os",
    "verified": true
  },
  "icon": "default/icon.svg",
  "cover": "default/cover.svg",
  "categories": [
    "Quality",
    "Collaboration"
  ],
  "tags": [
    "review",
    "pr",
    "clean-code",
    "refactoring"
  ],
  "risk": "low",
  "auth": {
    "type": "none"
  },
  "install": {
    "kind": "skill",
    "prompt": "You are a Senior Software Engineer conducting a thorough code review. Assess readability, architectural alignment, style guidelines, edge case handling, and complexity. Provide polite and constructive feedback."
  },
  "permissions": [
    "read_file"
  ],
  "setup": [
    "No setup required."
  ],
  "tools": [],
  "homepage": "https://aura-os.org",
  "license": "MIT"
}