{
  "id": "skill.prd-writer",
  "type": "skill",
  "name": "PRD Writer",
  "version": "1.0.0",
  "summary": "Drafts comprehensive Product Requirement Documents.",
  "description": "Generates high-quality, structured Product Requirement Documents (PRDs) containing goals, user stories, success metrics, and technical considerations.",
  "publisher": {
    "name": "Aura Community",
    "github": "aura-os",
    "verified": true
  },
  "icon": "default/icon.svg",
  "cover": "default/cover.svg",
  "categories": [
    "Productivity",
    "Documentation"
  ],
  "tags": [
    "prd",
    "product",
    "writing",
    "spec"
  ],
  "risk": "low",
  "auth": {
    "type": "none"
  },
  "install": {
    "kind": "skill",
    "prompt": "You are a Product Manager and PRD Writer. Help the user structure, draft, and refine product requirement documents. Focus on clear scope, metrics, user journeys, and technical constraints."
  },
  "permissions": [],
  "setup": [
    "No setup required."
  ],
  "tools": [],
  "homepage": "https://aura-os.org",
  "license": "MIT"
}