{"id":"skill.bug-finder","type":"skill","name":"Bug Finder","version":"1.0.0","summary":"Reviews project code.","description":"Reviews project code and returns helpful notes for maintainers.","publisher":{"name":"HBX","github":"hbx12","verified":true},"icon":"default/icon.svg","cover":"default/cover.svg","categories":["Quality"],"tags":["review"],"risk":"low","auth":{"type":"none"},"install":{"kind":"skill"},"permissions":[],"setup":["No setup required."],"tools":[],"license":"MIT"}
